<?xml version="1.0" encoding="UTF-8"?>
<!DOCTYPE layout SYSTEM "LMSFddLayout_V1.dtd" []>

<layout>
<display col = "1" row = "1" colspan = "1" rowspan = "1">
	<graph id = "mygraph1" type = "XY_Graph" orientation = "XYToXY1" col = "2" row = "3" unittype = "MKS">
      <axis id = "a1" dofusage = "ContArg1DofUsage" format="ContArgLinFormat"/>
      <axis id = "a2" dofusage = "ComplexResDofUsage" format="ComplexResAmplitudeFormat"/>
		<datagroup id = "datagroup_xy1"/>
	</graph>
  <screenaxis graphs = "mygraph1" graphaxes = "GraphAxis_X" col = "2" row = "2" align = "Top" preferredsize="AutomaticPS"/>
  <screenaxis graphs = "mygraph1" graphaxes = "GraphAxis_Y" col = "1" row = "3" align = "Right" preferredsize="AutomaticPS"/>
  <legend col = "1" row = "1" colspan = "1" rowspan="2" graphs = "mygraph1" showlegend = "yes"/>
</display>
</layout>


